dataset_id	display_name	accession_or_source	public_landing_page	data_type	analysis_role	evidence_level	cells_used	primary_manuscript_items	raw_data_status	included_source_files	rebuild_commands	limitations
norman2019	Norman 2019 K562 CRISPRa	GSE133344	https://www.ncbi.nlm.nih.gov/geo/query/acc.cgi?acc=GSE133344	Perturb-seq CRISPRa	CEBPE PGAA-H ranking example; six-perturbation PGAA-H calibration; multi-perturbation PGAA-W extension (KLF1, CEBPE, CEBPA)	Experimental perturbation screen	111668 total; CEBPE 566; six selected perturbations 663-1197 each	Figure 3; Figure 4; Supplementary Figures 2-3; Supplementary Tables 3-5	Partial raw/processed workflow; full Multi-perturbation and MMD-PSM rerun requires processed Norman h5ad input (verified from clean archive when NORMAN2019_H5AD supplied)	scripts/norman2019_prt_s1_full.csv;scripts/norman2019_prt_s2_nbins20.csv;scripts/norman2019_prt_s2_calibrated.csv;scripts/table_sceptre_vs_pgaa.csv;figure_source_data/fig3_norman_s2_volcano.csv;figure_source_data/fig3_elane_ranks.csv;figure_source_data/cebpe_target_ranks.csv;figure_source_data/fig4_calibration.csv	scripts/benchmark_norman_multi_perturbation.py;scripts/benchmark_mmd_psm.py;source-data reproduction from included CSVs;full rerun requires processed Norman h5ad input set via NORMAN2019_H5AD	Processed h5ad input is required for full rerun; 500 PGAA-H permutations support ranking evidence rather than genome-wide FDR discovery; mmd_psm_summary.csv is a legacy computational log (not used for manuscript claims—see file header)
adamson2016	Adamson 2016 K562 CRISPRi UPR	GSE90546	https://www.ncbi.nlm.nih.gov/geo/query/acc.cgi?acc=GSE90546	Perturb-seq CRISPRi	Independent UPR ranking benchmark	Experimental perturbation screen	5680 after QC; five selected UPR perturbations 468-686 each; 1759 non-targeting controls	Figure 2; Supplementary Figure 1; Supplementary Tables 1-2	Source-data reproduction from curated benchmark CSVs plus raw 10X001 sanity rerun	scripts/adamson2016_full_results.csv;scripts/adamson2016_results.csv;figure_source_data/fig6_adamson_results.csv;figure_source_data/adamson_gene_level_scores.csv;figure_source_data/adamson_bhlhe40_distribution.csv	python3 scripts/rebuild_adamson_full_results.py; python3 scripts/benchmark_adamson2016.py	Raw script loads GSE90546 GSM2406675_10X001 and reproduces the selected-target AUROC scale; final PDF table rebuilt from curated source-data CSV
cll2018	CLL 20k	GSE111014	https://www.ncbi.nlm.nih.gov/geo/query/acc.cgi?acc=GSE111014	Observational scRNA-seq	PGAA-W marker recovery and PGAA-W/PGAA-H complementarity	Observational marker-recovery analysis	36601 available; 20000 subsampled	Figure 5; Supplementary Figure 5; Supplementary Table 6; Supplementary Methods (CLL rank-score analysis)	Source-data reproduction from included summary/figure CSVs; AUROC 0.958 computed against 13-gene BCR marker set	scripts/cll20k_tcl1a_s1.csv;scripts/cll20k_tcl1a_s2.csv;figure_source_data/fig5_cll_s1_top100.csv;figure_source_data/fig5_cll_s2_top100.csv;figure_source_data/fig5_overlap.txt;figure_source_data/fig2_multidataset.csv	Source-data reproduction only; no single raw-GEO command in submission package	Virtual TCL1A grouping is not an experimental intervention and should not be interpreted causally
sepsis2021	Sepsis 20k	GSE167363	https://www.ncbi.nlm.nih.gov/geo/query/acc.cgi?acc=GSE167363	Observational scRNA-seq	PGAA-W marker recovery	Observational marker-recovery analysis	64244 available; 20000 subsampled	Figure 5; Supplementary Table 6	Source-data reproduction from included summary CSVs	figure_source_data/fig2_multidataset.csv	Source-data reproduction only	Marker recovery only; not a perturbation screen
ra2021	RA 10k PBMC/monocyte dataset	GSE159117	https://www.ncbi.nlm.nih.gov/geo/query/acc.cgi?acc=GSE159117	Observational scRNA-seq	PGAA-W marker recovery	Observational marker-recovery analysis	10499	Figure 5; Supplementary Table 6	Source-data reproduction from included summary CSVs	figure_source_data/fig2_multidataset.csv	Source-data reproduction only	Marker recovery only; not a perturbation screen
pbmc3k	10x Genomics PBMC 3k demo	10x Genomics PBMC 3k demo	https://www.10xgenomics.com/resources/datasets/3-k-pbm-cs-from-a-healthy-donor-1-standard-1-1-0	Observational scRNA-seq	PGAA-W marker recovery and scale check	Observational marker-recovery analysis	2700	Figure 5; Supplementary Table 6	Source-data reproduction from included summary CSVs	figure_source_data/fig2_multidataset.csv	Source-data reproduction only	Demo dataset; not a perturbation screen
ibd2018	IBD 10k gut epithelial dataset	GSE116222	https://www.ncbi.nlm.nih.gov/geo/query/acc.cgi?acc=GSE116222	Observational scRNA-seq	PGAA-W marker recovery	Observational marker-recovery analysis	11175	Figure 5; Supplementary Table 6	Source-data reproduction from included summary CSVs	figure_source_data/fig2_multidataset.csv	Source-data reproduction only	Marker recovery only; not a perturbation screen
